{
  "generated_at": "2026-01-01T00:40:00Z",
  "repository": "git+https://github.com/wxmb01/codex-app-autonomous-runs.git",
  "version": "0.1.8",
  "status": "passed",
  "promotion": {
    "categories": [
      "global-validation",
      "performance",
      "documentation"
    ],
    "changed_files": [
      "scripts/promote-learning.mjs",
      "scripts/summarize-learning.mjs",
      "scripts/github-release.mjs",
      "templates/codex/skills/timed-autonomous-run/schemas/promotion-report.schema.json",
      "templates/codex/skills/timed-autonomous-run/schemas/learning-summary.schema.json",
      "tests/validate-long-run-simulation.js"
    ],
    "candidate_files": [
      "examples/long-run-simulation/codex-app-active-runs/medium-dashboard-hardening/improvement-candidates.jsonl"
    ],
    "validation_policy": "npm run test:all, 30-iteration hook benchmark, package dry-run, global install, manifest check"
  },
  "validation": [
    {
      "name": "open-source validation",
      "command": "npm test",
      "status": "passed"
    },
    {
      "name": "long-run simulation validation",
      "command": "npm run test:long-run",
      "status": "passed"
    },
    {
      "name": "hook benchmark",
      "command": "npm run bench:hooks -- --iterations=30 --max-avg-ms=200",
      "status": "passed"
    },
    {
      "name": "package dry-run",
      "command": "npm pack --dry-run --json",
      "status": "passed"
    }
  ],
  "install_result": {
    "status": "passed",
    "codex_home": "$CODEX_HOME",
    "manifest_version": "0.1.8"
  },
  "git": {
    "branch": "main",
    "commit_sha": "0000000000000000000000000000000000000188",
    "tag": "v0.1.8"
  },
  "github": {
    "push_result": {
      "command": "git push origin main",
      "status": "passed"
    },
    "release": {
      "status": "success",
      "tag": "v0.1.8",
      "release_url": "https://github.com/wxmb01/codex-app-autonomous-runs/releases/tag/v0.1.8"
    }
  },
  "reviewer": {
    "required": true,
    "used": true,
    "agent_type": "autonomous_reviewer",
    "result": "no P0/P1 findings; promotion report has install, commit, push, release, and reviewer evidence",
    "findings": "P2 release URL field required before readiness; addressed in this fixture"
  },
  "steps": [
    {
      "name": "deterministic promotion dry run",
      "command": "node scripts/promote-learning.mjs --dry-run --reviewer-result=fixture-reviewed",
      "status": "passed"
    }
  ]
}
